{
  "$schema": "https://json-schema.org/draft/2020-12/schema",
  "type": "object",
  "properties": {
    "id": {
      "type": "string",
      "minLength": 1
    },
    "name": {
      "type": "string",
      "minLength": 1
    },
    "description": {
      "type": "string"
    },
    "versions": {
      "minItems": 1,
      "type": "array",
      "items": {
        "type": "object",
        "properties": {
          "version": {
            "type": "integer",
            "minimum": 1,
            "maximum": 9007199254740991
          },
          "note": {
            "type": "string"
          },
          "settings": {
            "type": "object",
            "properties": {
              "account": {
                "type": "object",
                "properties": {
                  "initialPoolPercent": {
                    "type": "number",
                    "exclusiveMinimum": 0,
                    "maximum": 100
                  },
                  "addPoolPercent": {
                    "type": "number",
                    "minimum": 0,
                    "maximum": 100
                  },
                  "reservePercent": {
                    "type": "number",
                    "minimum": 0,
                    "maximum": 100
                  },
                  "stockCapPercent": {
                    "type": "number",
                    "exclusiveMinimum": 0,
                    "maximum": 100
                  },
                  "sectorCapPercent": {
                    "type": "number",
                    "exclusiveMinimum": 0,
                    "maximum": 100
                  },
                  "maxPositions": {
                    "type": "integer",
                    "minimum": 1,
                    "maximum": 20
                  },
                  "riskPerPositionPercent": {
                    "type": "number",
                    "exclusiveMinimum": 0,
                    "maximum": 5
                  },
                  "openRiskPercent": {
                    "type": "number",
                    "exclusiveMinimum": 0,
                    "maximum": 10
                  },
                  "dailyLossPercent": {
                    "type": "number",
                    "exclusiveMinimum": 0,
                    "maximum": 10
                  },
                  "lossStreakPause": {
                    "type": "integer",
                    "minimum": 0,
                    "maximum": 10
                  },
                  "maxNewPositionsPerDay": {
                    "type": "integer",
                    "minimum": 1,
                    "maximum": 50
                  },
                  "cooldownMinutes": {
                    "type": "integer",
                    "minimum": 0,
                    "maximum": 9007199254740991
                  }
                },
                "required": [
                  "initialPoolPercent",
                  "addPoolPercent",
                  "reservePercent",
                  "stockCapPercent",
                  "sectorCapPercent",
                  "maxPositions",
                  "riskPerPositionPercent",
                  "openRiskPercent",
                  "dailyLossPercent",
                  "lossStreakPause",
                  "maxNewPositionsPerDay",
                  "cooldownMinutes"
                ],
                "additionalProperties": false
              },
              "execution": {
                "type": "object",
                "properties": {
                  "delayMs": {
                    "type": "integer",
                    "minimum": 0,
                    "maximum": 10000
                  },
                  "stressDelayMs": {
                    "type": "integer",
                    "minimum": 0,
                    "maximum": 10000
                  },
                  "slippageTicks": {
                    "type": "integer",
                    "minimum": 0,
                    "maximum": 20
                  },
                  "stressSlippageTicks": {
                    "type": "integer",
                    "minimum": 0,
                    "maximum": 20
                  },
                  "maxQuoteAgeMs": {
                    "type": "integer",
                    "minimum": 100,
                    "maximum": 60000
                  },
                  "maxSpreadBps": {
                    "type": "number",
                    "exclusiveMinimum": 0,
                    "maximum": 200
                  },
                  "maxSpreadToStopPercent": {
                    "type": "number",
                    "exclusiveMinimum": 0,
                    "maximum": 100
                  },
                  "maxDepthPercent": {
                    "type": "number",
                    "exclusiveMinimum": 0,
                    "maximum": 100
                  },
                  "minFillPercent": {
                    "type": "number",
                    "exclusiveMinimum": 0,
                    "maximum": 100
                  }
                },
                "required": [
                  "delayMs",
                  "stressDelayMs",
                  "slippageTicks",
                  "stressSlippageTicks",
                  "maxQuoteAgeMs",
                  "maxSpreadBps",
                  "maxSpreadToStopPercent",
                  "maxDepthPercent",
                  "minFillPercent"
                ],
                "additionalProperties": false
              },
              "market": {
                "type": "object",
                "properties": {
                  "marketGate": {
                    "type": "boolean"
                  },
                  "marketIndex": {
                    "type": "string",
                    "minLength": 1,
                    "maxLength": 40,
                    "pattern": "^[A-Z0-9 &-]+$"
                  },
                  "indexRangeMinutes": {
                    "type": "integer",
                    "exclusiveMinimum": 0,
                    "maximum": 9007199254740991
                  },
                  "declineVetoPercent": {
                    "type": "number",
                    "exclusiveMinimum": 0,
                    "maximum": 100
                  }
                },
                "required": [
                  "marketGate",
                  "marketIndex",
                  "indexRangeMinutes",
                  "declineVetoPercent"
                ],
                "additionalProperties": false
              },
              "signal": {
                "type": "object",
                "properties": {
                  "minRelativeVolume": {
                    "type": "number",
                    "exclusiveMinimum": 0
                  },
                  "volumeBaselineSessions": {
                    "type": "integer",
                    "minimum": 5,
                    "maximum": 60
                  },
                  "minStopAtr": {
                    "type": "number",
                    "exclusiveMinimum": 0,
                    "maximum": 20
                  },
                  "maxStopAtr": {
                    "type": "number",
                    "exclusiveMinimum": 0,
                    "maximum": 20
                  },
                  "atrPeriod": {
                    "type": "integer",
                    "minimum": 2,
                    "maximum": 50
                  },
                  "contextEmaPeriod": {
                    "type": "integer",
                    "minimum": 2,
                    "maximum": 100
                  },
                  "rangeSpanAtr": {
                    "type": "number",
                    "exclusiveMinimum": 0,
                    "maximum": 20
                  }
                },
                "required": [
                  "minRelativeVolume",
                  "volumeBaselineSessions",
                  "minStopAtr",
                  "maxStopAtr",
                  "atrPeriod",
                  "contextEmaPeriod",
                  "rangeSpanAtr"
                ],
                "additionalProperties": false
              },
              "timing": {
                "type": "object",
                "properties": {
                  "earliestEntry": {
                    "type": "string",
                    "minLength": 5,
                    "maxLength": 5,
                    "pattern": "^(09:(1[5-9]|[2-5][0-9])|1[0-4]:[0-5][0-9]|15:[01][0-9]|15:2[0-9])$"
                  },
                  "lastEntry": {
                    "type": "string",
                    "minLength": 5,
                    "maxLength": 5,
                    "pattern": "^(09:(1[5-9]|[2-5][0-9])|1[0-4]:[0-5][0-9]|15:[01][0-9]|15:2[0-9])$"
                  },
                  "squareOff": {
                    "type": "string",
                    "minLength": 5,
                    "maxLength": 5,
                    "pattern": "^(09:(1[5-9]|[2-5][0-9])|1[0-4]:[0-5][0-9]|15:[01][0-9]|15:2[0-9])$"
                  },
                  "maxHoldMinutes": {
                    "type": "integer",
                    "minimum": 1,
                    "maximum": 375
                  }
                },
                "required": [
                  "earliestEntry",
                  "lastEntry",
                  "squareOff",
                  "maxHoldMinutes"
                ],
                "additionalProperties": false
              },
              "data": {
                "type": "object",
                "properties": {
                  "maxSessionGapSeconds": {
                    "type": "integer",
                    "minimum": 0,
                    "maximum": 300
                  }
                },
                "required": [
                  "maxSessionGapSeconds"
                ],
                "additionalProperties": false
              }
            },
            "required": [
              "account",
              "execution",
              "market",
              "signal",
              "timing",
              "data"
            ],
            "additionalProperties": false
          },
          "frozen": {
            "type": "boolean"
          },
          "hash": {
            "anyOf": [
              {
                "type": "string",
                "pattern": "^[a-fA-F0-9]{64}$"
              },
              {
                "type": "null"
              }
            ]
          },
          "createdAt": {
            "type": "string",
            "format": "date-time",
            "pattern": "^(?:(?:\\d\\d[2468][048]|\\d\\d[13579][26]|\\d\\d0[48]|[02468][048]00|[13579][26]00)-02-29|\\d{4}-(?:(?:0[13578]|1[02])-(?:0[1-9]|[12]\\d|3[01])|(?:0[469]|11)-(?:0[1-9]|[12]\\d|30)|(?:02)-(?:0[1-9]|1\\d|2[0-8])))T(?:(?:[01]\\d|2[0-3]):[0-5]\\d:[0-5]\\d(?:\\.\\d+)?(?:Z))$"
          },
          "frozenAt": {
            "anyOf": [
              {
                "type": "string",
                "format": "date-time",
                "pattern": "^(?:(?:\\d\\d[2468][048]|\\d\\d[13579][26]|\\d\\d0[48]|[02468][048]00|[13579][26]00)-02-29|\\d{4}-(?:(?:0[13578]|1[02])-(?:0[1-9]|[12]\\d|3[01])|(?:0[469]|11)-(?:0[1-9]|[12]\\d|30)|(?:02)-(?:0[1-9]|1\\d|2[0-8])))T(?:(?:[01]\\d|2[0-3]):[0-5]\\d:[0-5]\\d(?:\\.\\d+)?(?:Z))$"
              },
              {
                "type": "null"
              }
            ]
          }
        },
        "required": [
          "version",
          "note",
          "settings",
          "frozen",
          "hash",
          "createdAt",
          "frozenAt"
        ],
        "additionalProperties": false
      }
    },
    "createdAt": {
      "type": "string",
      "format": "date-time",
      "pattern": "^(?:(?:\\d\\d[2468][048]|\\d\\d[13579][26]|\\d\\d0[48]|[02468][048]00|[13579][26]00)-02-29|\\d{4}-(?:(?:0[13578]|1[02])-(?:0[1-9]|[12]\\d|3[01])|(?:0[469]|11)-(?:0[1-9]|[12]\\d|30)|(?:02)-(?:0[1-9]|1\\d|2[0-8])))T(?:(?:[01]\\d|2[0-3]):[0-5]\\d:[0-5]\\d(?:\\.\\d+)?(?:Z))$"
    },
    "updatedAt": {
      "type": "string",
      "format": "date-time",
      "pattern": "^(?:(?:\\d\\d[2468][048]|\\d\\d[13579][26]|\\d\\d0[48]|[02468][048]00|[13579][26]00)-02-29|\\d{4}-(?:(?:0[13578]|1[02])-(?:0[1-9]|[12]\\d|3[01])|(?:0[469]|11)-(?:0[1-9]|[12]\\d|30)|(?:02)-(?:0[1-9]|1\\d|2[0-8])))T(?:(?:[01]\\d|2[0-3]):[0-5]\\d:[0-5]\\d(?:\\.\\d+)?(?:Z))$"
    }
  },
  "required": [
    "id",
    "name",
    "description",
    "versions",
    "createdAt",
    "updatedAt"
  ],
  "additionalProperties": false
}
